id,title,date,content
237,Výlet s panem Nohavicou,sobota 10. května 2014,"Bereš mě, milý čaroději, zase

na výlet v mém nitru a v čase…
Nechám se ráda unášet
na vlnách Tvých strun do mých nácti let.

Večerní loukou jednorožec cválá,

zas je tu rybník, když jsem byla malá,

na hladině vidím popelavou čírku

a rybář chytá hvězdy do vezírku.

Na vodě vážky dovádí jak víly

a jejich obraz v měsíčním svitu černobílý

v zrcadle občas ruší jenom úsměv ryb,

matně si vzpomínám na svým snům daný slib.

Přemýšlím, kolik osudů z Tvých písní,

kolik těch příběhů jsi jenom vysnil,
které z nich nikdo nezažije..

zasel jsi kdysi do mého srdce semínka poezie.

Každý den Tvoje básně žijem,
každý den říkám si: Carpe diem.
Občas ty písně zazpívám a ukloním se jemně..
Tys pro mě básník téhle krásné země."
238,Chvíle,úterý 3. června 2014,"Do některých chvil se nořit jako do peřin,
znovu a zase s nimi usínat a ráno vstávat.
Třeba do té, kdy s Tebou večeřím
a ještě vůbec nemyslíme na náš návrat.

Noční tmou ohňostroj hvězd srší,
nespím… Tvá paže okolo mého boku…
V zahradě na květy tiše prší..
Chtěla bych zůstat tak ještě tisíc roků…"
239,Klobouk,sobota 14. června 2014,"Na stropě v modrém pokoji
počítám ovečky, čekám na beránka,
měsíc se venku topí v závoji
rozpitý na nebi jak bílá kaňka

a proužek světla sklem dveří v předsíni
proniká a s ním sem vchází noční svět
můj starý klobouk na skříni
vzal na sebe tíhu let…"
240,Krátká košilka,neděle 15. června 2014,"Někdy si sním, když vzduch je plný
chvění, za víčky vidím elegantní klipr,
jak s grácií lehce krájí vlny
a čechrá mořskou hladinu i vítr

ta plachetnice vonící po čaji a vanilce..
Námořníkům se o ní zdává k ránu
o tanečnici v krátké košilce –
kouzelné královně oceánů…"
241,Obrázek,neděle 1. června 2014,"Až slunce nebude mít sílu,
až spolu zbudeme si pro sebe
v jednom maličkém bodě našeho světadílu,
už nikdy nebudu chtít být bez Tebe.

Do noci budeme si vyprávět, než nám dojde dech,
příběhy našich životů a klást si moře otázek…
Pak udělá se mlha na okenních sklech,
a já do ní nakreslím pro Tebe obrázek…"
242,Plachetnice,středa 25. června 2014,"Na klidné moře vypluly bílé plachetnice,
jsou jako v umyvadle plném ořechových skořápek
a jejich stěžně září v slunci jako svíce,
jak voda na mé kůži roztříštěná do kapek…"
243,Přijdu,pondělí 23. června 2014,"Pokorná a k smrti vysílená
před Tebou, Lásko, padnu na kolena,
zbavená všech vydobytých postů,
ztracená v ranním zpěvu skřivánčím,
přijdu k Tobě po dlouhém mostu,
po mostu, na němž se netančí…"
244,Skok II,sobota 14. června 2014,"20.11.2012
Jsem. Snáším se k zemi. Jsem sněhová vločka.
Ze všech sil volám, ať ohlédne se, počká.
Prochází mnou jako stínem a neví. O něm jsem snila.
Rozpouštím se v kaluži špíny jak malá mořská víla.

14.6.2014
Jsem. Snáším se k zemi. Jsem sněhová vločka.
Barevná vločka pokrytá pylem po babočkách
jejichž křídla jsem zlehka oprášila a teď tu tančím jako víla.
Je tady on – moje vše, o čem jsem tajně snila."
245,Slůvka,čtvrtek 12. června 2014,"Počítám hladké barevné oblázky,
které jsi chladil ve svých dlaních,
hebkými rty horkými od lásky
do uší šeptám Ti, když se bráním,

že některá slůvka, která říkám plaše,
zůstanou navždy jenom naše…"
246,Stopy,čtvrtek 12. června 2014,"Mezi lesklými korálky písku
posbírej pár něžných kamínků,
moře pak vlije vlny do otisků,
mně oblázky vtisknou jak polibek vzpomínku…

A kdybych snad přece jen jednou zapomenout měla,
rozházím oblázky do trávy.. zahladím stopy zcela…"
247,Tajuplný,sobota 14. června 2014,"Dnes jenom já a malá noční káva.,
když květy lotosů jsou bělejší než vlny
a nebe rudé jako žhavá láva,
večer se zdá být tajuplný…"
248,Taneční,pondělí 30. června 2014,"Na střechy padá déšť a odměřuje čas
a slunce zatím tančí v nás,
září a hřeje jako na poušti,
tma uvnitř mne se rozpouští…
Večer se rozsvítí pouliční lampy
a naše srdce tlučou v rytmu samby…"
249,U knížky,neděle 1. června 2014,"V očích máš dálku.
Dívám se, jak si čteš.. smím?
Přitom máš celý svět v čajovém šálku…
můj Malý princ s velkými sny"
250,V nesnázích,pátek 6. června 2014,"Na nebi září Orion jak umyvadlo plné vody
a touha můj dům tiše obchází.
Okny i zdmi vysílá svoje tajné kódy,
se sklenkou vína jsem tu sama – v nesnázích.

Měsíce zář pro jednou si vypůjčím,
on jako poutník nad střechou se přesune,
na cestu za Tebou se vydám s ním
a potom už jen… sbohem, rozume."
251,Chodník,pondělí 28. července 2014,"Za Tebou vede chodník křivolaký
– je třeba zdolat velké vlny, rukama roztrhat mraky,
tisíckrát klopýtnout a párkrát pohnout skálou,
když získat chci Tvou lásku stálou…"
252,Naděje...,neděle 13. července 2014,"Sny proplouvají koridorem slov
Na jeho konci se ztrácejí
Za ničivých záblesků hypernov
spěchají pohřbít naději

Naději prchavou jak mořská pěna
vzdorovitou jak srdce rebelů
plachou jak srna poraněná
naději, kterou marně hledám v přítmí kostelů"
253,Noční,čtvrtek 31. července 2014,"Noc kreslí na stěnu tajemné siluety,
tma z černého saténu, déšť ťuká na parapety,
jak paličky na strunách něžné tóny zní.
Tak si tu po nocích často sama sním.
Oči mám od deště zamžené
a srdce… rozčepýřené"
254,Odstíny,středa 30. července 2014,"Neslyšně tma vtančila přes dvorky
každou noc odstíny má nové
dnes je jak hladká šíje kreolky
a ráno bude karmínové"
255,Pláč,pátek 11. července 2014,"Jakoby se zastavil čas…
stále jen na něco čekám.
Slzy se třpytí ve dvou řadách řas.
Můj pláč je ponorná řeka…"
256,Po dešti,čtvrtek 3. července 2014,"V zahradě tiché stromy
a za zahradou potemnělé město.
Noční déšť střechy omyl,
s nimi pár veršů poztrácených cestou…"
257,Ráno,čtvrtek 17. července 2014,"Když ráno se slunce odlepí od obzoru,
trávím čas zkoumáním vzorů
tvořených paprsky na pokožce Tvých zad.
Obrázky zmizí, ale mé polibky, prosím, nesmývat…"
258,Saudade,středa 9. července 2014,"Do mého srdce projel jsi magistrálou,
vzal jsi je prudkou ztečí.
Když svlékal jsi poslední slupku okoralou,
bylo už pozdě brát do zaječích…

Teď dívám se do Tvého nitra –
do výkladní skříně – s věčným hladem,
s touhou a nadějí, co stane se snad zítra,
s darem či prokletím, které zvou – saudade…

Tvá duše žíznivá jak zem sežehlá sluncem,
něžná a křehká a plná vůní světa,
jak zlatý poklad v čínské džunce,
jak raněný pták, jenž padá a zase k mrakům vzlétá…

Tvá duše září ze Tvých oči zvláštním leskem,
má příchuť snů, které se k ránu v Tobě rodí,
Tvá bolavá duše protkávaná steskem,
steskem tajemným jako v mlze přídě lodí…."
259,Usměj se...,pondělí 7. července 2014,"Ještě se jen tak usmívej
Poslouchej šumění křídel ptáků
Jen tak se potichu podívej
Na pole plná bílých máků
Projdi se křížem krážem mojí duší
Usměj se ještě – ten důlek ve tváři Ti sluší…"
260,Vlčí máky,pondělí 7. července 2014,"V zlatavém poli jako čtvrťáky
rozhází slunce vlčí máky.
Usnu tam v obilí a do vlasů
spadnou mi kapky rosy… pro krásu"
261,Vzdor,čtvrtek 31. července 2014,"Tuším, že jednou Ti zevšední
mé pohyby, má opálená kůže,
můj smích, který do uší Ti zní.
Neměj strach, nebudeš mi dlužen…

Však odmítám smířit se s tím,
že drahokamy promění se v smetí
a ač běh života z hloubi duše ctím,
chci si vrýt navždy do paměti

každý Tvůj úsměv, každý nádech,
prstoklad Tvojí ruky na mých zádech…"
262,Krasohled,neděle 3. srpna 2014,"Rozkošnicky přivírám svá víčka
pod řasami mám krasohled
prohlížím Tvé dlaně přes barevná sklíčka
z čar tam máš poskládaný celý svět

Jsou jako cesty – svět plný znamení
a tajemných krás, zdali je rozpoznáme včas?
Nebo je přehlédnem životem znavení?
Chci být Tvým znamením…. uslyš můj vzkaz…."
263,Nehoda,pátek 1. srpna 2014,"Když měsíc usnul, komety své šaty svlékly.
Otevřel oči, lekl se a srpkem propích do oblohy díru.
Hvězdy se tou dírou rychle rozutekly.
Nebe je černé – ony toulají se po vesmíru…"
264,Některé věty,pondělí 11. srpna 2014,"Na některé věty.. už není co říct..
jen v krku pálí pláč,
jak uvnitř srdce tiše hoří.
Jen ono ví, co já jsem zač..

Některá slova jsou palčivá
jak slunce na poušti.
Pláču, jen když se nikdo nedívá..
Kde je to tlačítko, kterým se odpouští?

Na duši bolí mě šlápoty.
Kdyby tak šlo zchladit srdce vodou.
Jsem tady sama.. právě tak, jako Ty..
a polomrtvá touhou.."
265,Pojeď,pátek 1. srpna 2014,"Brodím se tmou, teče mi do šálku
pojeď už za mnou a krájej dálku
ukroj kus noci, ukroj kus mého bolu
ukroj kus noci a sníme ji spolu"
266,Pokora,pátek 29. srpna 2014,"Když utápím se ve smutku a zlobě,
když smrti věřím víc než sobě,

když hrozí mi, že ztratím svoji cestu,
tak posadím se v trávě pod jabloní

Ty potom… slož mě jako stavebnici,
jak v Golemovi zažni ve mně svíci.

Já na kolenou v tichém gestu
pokorně před Tebou svou hlavu skloním…"
267,Proč...,sobota 23. srpna 2014,"Chtěla bych spatřit hvězdu, jak padá k Zemi
a cítit, jak mi srdce rozechvěje.
Marně se toulám spícími ulicemi
s kapsami plnými beznaděje.

Svírá mne úzkost a v dlaních nemám nic,
slzy se zadrhly a visí někde v hrudi,
pak zaplaví černé terče zřítelnic,
vím, z toho snu nikdy se neprobudím…

Proč má jít láska s bolestí ruku v ruce?
Proč se tmou rozléhá dotěrný rytmus mého srdce?"
268,Superměsíc,pondělí 11. srpna 2014,"Růžový měsíc a jeho moře
ve večerní výloze
tak, jak byl stvořen,
koupe se v obloze.
A tady zatím půlka léta
Slyším jen ticho.. a tep světa"
269,Tanec na hladině,sobota 9. srpna 2014,"Jsem jenom kapkou v moři Tvých snů
tančím svůj tanec na hladině
občas se topím v mořské pěně dnů
s rukama složenýma v klíně…

Když Tvá paže se mne nedotýká
hodím Ti lano a naše ruce se pak spojí
Jsem něžná a křehká jako majolika
jsem lodí v bouři, Ty buď mou bójí…"
270,Veď mne,pátek 1. srpna 2014,"Po nebi jdou mraky jako černé saze
příliš pomalu se Země pro mne točí
ztratím se tiše na oběžné dráze
vidím miliony hvězd, září jak Tvoje oči

Hej, chlapče s očima plnýma hvězd
chci se dát Tebou ve tmě vést
často se v temných nocích ztrácím
a nejsem dobrá v navigaci…"
271,Zpráva v láhvi,středa 6. srpna 2014,"Ještě si někde pluješ mořem
a čekáš svého adresáta.
Přináší lásku, nebo hoře
ta slova větrem rozevlátá?

Jsi tajuplná zpráva v láhvi ze skla,
vlny si s Tebou pohrávají,
jsi jako slza, kapka lesklá,
tomu, kdo čte Tě, dech se tají.."
272,Bělásek,středa 10. září 2014,"Bělásek spočítá modré květy levandulí,
pohladí křídly stébla trávy, když se k sobě tulí,
pak usne na leknínu, po rybníku plave,
nechť hvězdy jsou dnes k němu shovívavé…

Ráno, až do zahrady ke kávě si sednu bosá,
běláska na leknínu vzbudí chladná rosa,
odlétne ještě někam do plného léta.
Sedne Ti na rameno na druhé straně světa…"
273,Hoře,pátek 12. září 2014,"Napiš mi na kůži zprávu krátkou
vyryj tam čitelně celé své hoře
zavři mne do lahve a utěsni zátkou
hoď mě jak vzkaz do divokého moře

ať před steskem a trápením Tě chráním
v noci se roztříštím v příboji o skaliska
utopím Tvou bolest a svoji přidám k ní
snad zbude pro nás pak jen láska čistá"
274,Střípky,úterý 2. září 2014,"Už ze mě zbývají jen malé střípky
Lepí se, nejde umýt moje vina
Mé srdce nakrájené do polívky
Bez Tebe je mě jenom polovina"
275,Teď,úterý 16. září 2014,"Schoulená v klubku pod dekou
čtu časopis a už zase sním.
Chci vykonat cestu dalekou..
s Tebou.. až na kraj světa… smím?

S večerem ruku v ruce se do pařížské modři vmíchat,
pak ve tmě pokoje naučit se znát Tě nazpaměť
a každou vteřinu vůni Tvé kůže dýchat.
Už nechci čekat – chci žít všechna svá i Tvoje ""teď""…"
276,Před svítáním,sobota 6. září 2014,"Maličké pírko vzala jsem do dlaní,
Měsíc si jenom tak mezi mraky stál,
daleko ještě zbývalo k svítání
a já si přála jen, abys se mnou posnídal

Ty, který umíš bez klíče odemknout moje srdce
jen pohledem či dotykem horké dlaně,
když do těch svých vezmeš mi ruce
a úsměvem otřeš moje tváře slané

Těším se na Tebe.. a zatímco nejsi tu,
prohlížím řádky psané Tvou rukou do školního sešitu…"
277,Věčnost,středa 3. září 2014,"Někdy se zdá, že moje slunce chladne –
to, které zahřívá mé sny.
Za oknem odchází den za dnem,
mizí do chladné noční tmy.

Všechno se rozpouští v útrobách nocí –
ztracený čas, kdy nedotýkal ses mých vlasů,
zmeškané sny, Tvé ruce na mých bocích,
horoucí objetí kolem pasu.

Každý den bez Tebe je zbytečnost..
Nech mne to, prosím, ještě zažít.
Vím, jak snadno lze nacházet věčnost
v každičkém záhybu Tvých paží…"
278,Chci,úterý 28. října 2014,"Jsou věci, o kterých se mluvit nesluší.
Kéž bys je cítil, kéž bys věděl…
V podobě větru chci šumět Ti do uší,
já – živel – učím se Tvojí abecedě…

Pak prstem mi shrneš vlasy z čela
a ve Tvých očích smím se navždy ztrácet.
Ty budeš vědět, na cokoliv jsem pomyslela..
každý Tvůj dotek chci Ti dvakrát vracet.."
279,Chybíš mi,úterý 7. října 2014,"Chybíš mi
s Tvými myšlenkami něžnými
s tváří otlačenou od brýlí
se zlobou, která Tě vysílí
s tím vším, Lásko, chybíš mi"
280,Souhvězdí Blíženců,sobota 25. října 2014,"Obloha těžkne hvězdami
a mnohé o nás jistě ví
hloubka té noci mne omámí
počkám, až se objeví
souhvězdí Blíženců nad Tvými rameny
Jsi srdci blízko.. přitom tak vzdálený

A v tichu vesmíru
slýchám to Blíženců tiché volání
spěchají, jsou s časem na štíru
na výpravě za poznáním
při plavbě za Zlatým rounem loď hrozí lehnout popelem
Astore, Poluxi sviťte mi svými hvězdami na čele

Až budu u cíle,
dejte mi znamení, pro mne už není cesta zpět
na cestě za pokladem odolám přesile
dřív nejsem připravena opustit tento svět

a kdyby přece jen, tak jednou v místech, kde to znáš,
pohlédni na nebe, najdi tam hvězdu…. a to budu já.."
281,Vana,pátek 17. října 2014,"Ležím si v peřinách a sním tiše
o vaně plné horké vody
Na jejím okraji dvě poloprázdné číše
hladina jen pro dobré lodivody

Když noc pak pozhasíná všechna světla
na nebi zčernalého blankytu
Slova, jež řekl jsi, bych nespočetla
Jsi zdrojem všech mých pocitů…"
282,Z papírových snů,pondělí 6. října 2014,"Ze všedních dnů
z kalných vod
z papírových snů
zjevila se loď

Z kaluží a bláta
krásná, až dech se tají
ve slunci celá zlatá
a plachty vítr nabírají

Když budeš mě mít rád
poplujem tam, kde den si na noc kabát věsí
kde nořím prsty do klaviatury Tvých zad
kde žhavé slunce mizí mlčky za útesy.."
283,Zlatá rybka,úterý 28. října 2014,"Míváme strach setkat se s neznámem
Některých cest dlouho se zdráháme
V divokých vodách, když doplujem k pramenům
pár zlatých rybek snad naleznem v čeřenu

Tak často pluji proti proudu temných řek
v nichž voda chutná víc než trpce
hledám na věčnou bolest lék
hledám svou rybku radarem mého srdce"
284,Zloba,pondělí 20. října 2014,"Někdy se stane.. že náhle ztratím hlas…
když Tvoje zloba jak ledová sprcha
jak jehla do srdce mě bodne a zastaví se čas
a já mám strach, že nikdy nevyprchá
mám strach, že jediná Tvá věta
v tu chvíli předznamená konec světa.."
285,Až odejdu,středa 19. listopadu 2014,"Až odejdu a nebudeš už smět
dělat ty všední věci, o které bys stál,
bude Ti líto nevyřčených vět.
Bude Ti líto, žes mne víc nelíbal…"
286,Bezesné noci,pátek 7. listopadu 2014,"Za některých nocí bezesných
stýská se mi, až to bolí
a tolik toužím po Tvých dotecích
že ďáblu bych kývla na cokoli"
287,Cesty,středa 26. listopadu 2014,"Opři se o vítr a nech se nést
roztáhni ruce jak křídla běláska
ať vybereš si kteroukoliv z cest
na jejím konci bude moje láska"
288,Čokoládová košilka,sobota 1. listopadu 2014,"V čokoládové košilce
má noc příchuť mléčných karamel
po jejich vůni najdeš mě ve chvilce
i kdybys ve tmě neviděl

Po vůni karamel a po zvuku mého dechu
najdeš mě a zaboříš mi nos do vlasů
uprostřed noci přijdeš si pro útěchu
vletíme do spánku na křídlech pegasů…."
289,Když budeš smutný,středa 26. listopadu 2014,"Když budeš smutný, když budeš brečet,
vezmu si klaunský nos a budu se ptát, co se děje
a koleno Ti budu foukat vkleče,
tak dlouho, dokud se neusměješ…"
290,Mapa hvězd,středa 26. listopadu 2014,"Na písku, který září
jak malé lesklé korálky,
měsíc se odráží ve Tvé tváři,
v zajetí šumění moře a zahálky
zabodni prst do mapy hvězd.
Osudem k tomu místu necháme se vést"
291,Návraty,úterý 25. listopadu 2014,"Až vedle Tebe moje vůně na polštáři vybledne,
až noci zdát se budou bezedné,
tak dej mi vědět. Zavolej a já se vrátím.
Vždyť odchody se často dějí pro návraty…"
292,Pravda,sobota 1. listopadu 2014,"Pravda je ve víně,
či v kávové sedlině..
Často však… koho by napadlo,
že trůní uprostřed.. jak včelí žihadlo…

Hádej a počítej v duchu do sta,
má pravda je velmi prostá
a sladká jako marmeláda –
pravda je, že Tě mám prostě ráda.."
293,Rozbřesk,středa 19. listopadu 2014,"Půlměsíc koupe se v moři u ostrova,
potom jak bárka nebem pluje,
přemýšlí, kam se ráno schová,
když za rohem světa rozbřesk přešlapuje…"
294,Tajenka,úterý 25. listopadu 2014,"Světlo jak štětcem přes okenní sklo
maluje vzory na Tvá ramena
šeptá Ti do kůže spoustu tichých slov
luštím ta slova a něžná písmena

Když vyjde mi tajenka, slíbám ji ze Tvých zad
horká krev jak řeka proudí mi divoce v žilách
nemusím přemýšlet, nemusím se už sebe ptát
Patřím Ti … Láska je nevypočitatelná síla"
295,Co jsem,středa 3. prosince 2014,"Skrývám své srdce před světem
od chvíle, kdy byla jsem dítětem
Pocity svěřuji bílému papíru
myšlenky – malé barevné korálky
Jsem jenom smítkem v úžasném vesmíru
Co jsem já, vejde se do šedé obálky"
296,Cosi,středa 31. prosince 2014,"Něco je jinak.. a já nevím, co.
Bolí mě probouzet se bez naděje,
usínat a do snů cítit trpkost slov
a na polštáři slané krůpěje
slz, co peří uvnitř vypije…
řekni.. že láska všechny viny přikryje…"
297,Jiný svět,úterý 30. prosince 2014,"Žít ve světě origami,
mít v něm jen malou roli
motýla, jenž vznáší se nad vodami
a když i v tom papírovém světě srdce bolí,
složit to srdce jako prádlo do skříně,
nechat je spát u voňavého sáčku s jasmínem…"
298,Jsi to Ty,sobota 27. prosince 2014,"Jsi to Ty, vím to, protože vidíš, co jiní nevidí,
protože všimneš si bolesti ukryté za úsměvem
a jsi si jistý láskou za mým hněvem.
Jsi to Ty a nikdy se to nezmění,
protože poznáš důvody mého mlčení,
když sedím s Tebou na přídi…"
299,Novoroční,středa 31. prosince 2014,"Až rok se zlomí a spočítá nám všechny skutky,
do srdcí jak do záhybů závěsu ukryjeme smutky,
aby se spolu s časem snad utopily v tůni,
pak měsíční moře skryje novoluní…."
300,Po hladině,sobota 6. prosince 2014,"Kolem nás míhají se malé rybky

pestré jak čabraky sultánových koní

lesklé jak zrcadlové střípky

hladina tyrkysovým světem voní

Vnímám, jak vítr učí zpívat vodní tříšť

v úžasu ohlédnu se po hejnu

racků, přisednu na příď a přisunu se blíž

Tvé tělo svým tělem zlehka obejmu"
301,Vánoční přání,středa 24. prosince 2014,"Klidné dny plné snů a pohádek,
ať dnešní večer svátečně nám voní.
Na poslední chvíli šikuji slova do řádek,
když Štědrý den už malým zvonkem zvoní.

Jak loďky v umyvadle plném vody
než hvězdy na oblohu vplují,
přeji všem, než Nový rok se zrodí,
Vánoce, jaké si z dětství pamatují…"
302,Vůně,pátek 19. prosince 2014,"Noc kolem je ebenově černá
jak africká žena, jako uhel, jako tér
tak tichá, tajemná a přenádherná
jak krajina snů, kde ze sametových per
vystlané lůžko na nás čeká
v němž náš čas plyne jako řeka

Nahmatám Tě.. po čichu Tě poznám
vnoříme se pod hladinu noci hedvábné
V krémové tmě Tvá vůně je neúprosná
To Tvoje duše voní neskutečně půvabně…
Když vstávám, voním Tebou ještě po ránu
a vím, že mužů jako Ty je dnes už.. jako šafránu…"
303,Chci Tě,čtvrtek 15. ledna 2015,"Jsi matador na koridě, v očích vášeň zakletou,
pro kterou milovat Tě chci a nikdy nepřestat
Máváš přede mnou rudou muletou.
Chci Tě a je mi jedno, co to bude stát."
304,Důvody,sobota 3. ledna 2015,"Miluji Tě nejen pro to, kým jsi,
zavážu si oči páskou černou
a směr mi nikdo napovídat nemusí,
za Tebou běžím cestou jednosměrnou.

O někom, jako jsi Ty, se mi zdá,
plujeme spolu bouří temnou.
Miluji Tě pro to, kým jsem já,
když Ty jsi se mnou…."
305,Hádky,pátek 30. ledna 2015,"Jen srdce člověka zná vlastní hněv
V zrcadle Tvých očí spatřuji svoje hříchy
Stydím se, útočím, topím se v jejich tmě
Tak hádky vznikají – z pouhé pýchy"
306,Noční vítr,sobota 10. ledna 2015,"Někdy potmě, když už ani nedoufám,
tak otevřu dveře nočnímu větru.
Zavřu oči, dýchám a poslouchám
Třesu se zimou bosá, jen v šedém svetru.

Naslouchám, jestli jsi napnul plachty,
jestli jsi vyplul a následuješ svoji hvězdu
a zda jsi stále se mnou spjatý.
Vítr zpívá, že Tvá loď pluje vstříc mému gestu…"
307,Noční výprava,úterý 6. ledna 2015,"Propluji nebem jak měsíc na veslici,
od komety nechám si cestou podat lžíci,
ochutnám hvězdy – mandle sladké,
v temnotách zahlédnu, co bylo před počátkem,
vzdušnými polibky pohladím planety stydlivé,
nechám se unášet a k ránu vrátím se na Zemi s odlivem…"
308,Panorama,pátek 23. ledna 2015,"Dívám se do neznáma,
do vlažné rozpité noční tuše
v dálce se rýsuje panorama
neobjeveného vesmíru Tvých tužeb"
309,Posedlá,pátek 30. ledna 2015,"Kde jsi Ty, je nejmagičtější místo na Zemi
Zas tančím zahradou s rozpálenými tvářemi
Uprostřed ledna večerní vzduch voní létem
To jsem já! Posedlá Tebou! Posedlá světem!"
310,Sny,pátek 23. ledna 2015,"Co Tě znám, mezi mraky jak plachetnice plují sny
Jsou všude kolem a nádherně voní,
na louce v podobě zlata na stvolech divizny
Jak kapky deště třpytí se ve hřívách koní
Děkuji, že jsi, žes nikdy nepolevil
Není snů bez toho, kdo by je snil…"
311,Ticho,neděle 18. ledna 2015,"Ticho… čelo pokryté krůpějemi…
Že můžu vstát, jen předstírám,
sražená v ringu obličejem k zemi,
ztracená ve vesmíru.. umírám"
312,Tvůj strach,čtvrtek 8. ledna 2015,"Máš obavy ztratit se v mém světě,
nechceš být mnou jak mlhou polapen,
ještě se bráníš, než láska dostihne Tě…
Cítím to každý jeden dlouhý den.

Neboj se, tak špatné to být nemusí.
Máš–li strach, že budeš mě mít raději než sebe,
tak zatím bojuj.. potrestej mne. Zvyknu si.
Až bolest srdce stane se mým denním chlebem,

pak možná náhle poznáš, že cesta je jen jedna.
Má láska zvítězí… sladká a bezohledná…."
313,U konce,neděle 4. ledna 2015,"Jsem u konce svých sil
a Tys ještě ani neokusil
jak chutnají mé slzy a rozmazaná růž
když slova zaříznou se do mě jako nůž
za oknem vnímám matně zpomalený děj
sněhové vločky se sypou jako beznaděj"
314,Vítr,pátek 23. ledna 2015,"Vítr přestal cuchat peří ptákům

přešel z fortissima do čerstvého vánku

s večerem prolistoval atlas mraků

nechal jej otevřený u červánků"
315,Bajka,neděle 8. února 2015,"Byla jsem koník divoký, bujný a veselý
lidé však do klece srdce mi zavřeli
Na nohy okovy, jimiž svazují otroky,
ale já stále jsem koník bujný a divoký
Nakonec z klece na křídlech Pegasů
srdce mne vynese nahoru k nebesům"
316,Bitvy,neděle 15. února 2015,"Láska není válka o to, kdo je lepší.
Láska jsou společné bitvy, ve kterých, dá–li nebe,
stane se silné z toho, co je nejkřehčí.
Touha a snaha být lepší než jsem..  pro Tebe.

A jak poznáš, že Tě miluji? Jak to objevíš,
že je ta cesta správně zvolena?
Že raději posadím se, když se mnou promluvíš,
protože ještě pořád se mi z Tebe podlamují kolena…"
317,Chladné hvězdy,pátek 6. února 2015,"Hvězdy se tajemně usmívají z výšky
jsou chladné jako zlaté plíšky
Když ten, kdo dnům dá smysl, se mnou není,
chci tančit v mokré trávě. Tančit k zapomnění"
318,Deštivé léto,pátek 6. února 2015,"Mám pocit, že celé léto prší
mám nový deštník a já jsem obyčejná
přemýšlím, co s mou starou duší..
která je taková, jak kdysi – stále stejná"
