id,title,date,content
106,Stuhy,neděle 11. srpna 2013,"Za šedých dnů vstoupil jsi do mé knížky,
když psala jsem stránku dva tisíce šedesát.
Stuhy našich osudů hladím prstovými bříšky,
ony poletují větrem – chtěla bych je učesat.

Vlní se, proplétají a vesele se jejich trasy klikatí,
jsou jako duha, hladce kloužou v dlaních.
Teď se mi zdá, že šedé dny se nikdy nevrátí,
barvy mění se a samy svazují se květy na nich.

Ty´s malíř a já stužka jemně fialová,
svým štětcem barvy na paletě mícháš,
něžně pak vnášíš do mých barev slova
– hned zasychají, jak zlehka na ně dýcháš.

Barevné stuhy vlají jak vlasy mořské sasanky,
proud času splétá je, šisuje a skládá.
V každé jedné vetkané jsou krásné hádanky.
Pojď, přisedneme k sobě a budeme hádat.."
107,Svítání,úterý 6. srpna 2013,"Svítá – za kopci oranžové ráno
maluje zátiší – nebe modelem mu sedí
Chlapec s dívkou si říkají svá ""Ano""
Bez hlesu, pohledem – jen oni vědí."
108,Třídění veršů,pátek 16. srpna 2013,"Mraky dnes plují pomalu
měsíc dorůstá
přikládám ke rtům píšťalu
rosa mi padá na ústa

Oheň se jasně rozhoří
jiskry se rozletí s bludičkami
mé verše tiše hovoří
v plamenech září jako drahokamy"
109,Schránka,pátek 30. srpna 2013,"Jazyk motýla pavího oka
jako pružina z oceli
do květu svlačce u potoka
noří se, jak když vystřelíš

stejně tak noří se do mého srdce
všechna Tvá slova, která jsi mi říkal
ještě když miloval jsi prudce
a mého citu jsi se neodříkal

Za tmavé noci chtěl jsi lásku
a požádal jsi anděla
do vlasů zapletl mu sedmikrásku
když byla jeho křídla ještě doběla

Do malé krabičky zavřu prázdno
převážu stuhou, aniž tuším
kam touhle řekou kdysi krásnou
dopluje schránka s mojí duší…"
110,Ztráty a nálezy,čtvrtek 1. srpna 2013,"Znuděná paní ze ztrát a nálezů,
šedivé oči schované za víčky,
já si jen říkám: ""Sem už víc nevlezu.""
Pak se však usmála – ve tvářích dolíčky.

A co prý hledám, co že prý postrádám?
Stačí si říct, po čem nejvíc toužívám.
Má tady obojky, klíče a kufříky,
knoflíky, tašky, prádla tři šatníky.

""Co hledám?"" na to já… ""To byste neměla.""
Úsměv mě povzbudí, tak spustím zvesela:
""Barevný kroužek na křídle motýla,
veliký klobouk, když fouká mi do týla…

Měňavou perlu ve škebli z rybníka,
dech, který stačil by, když dlouho utíkám.
V sklenici vody rozpuštěný Vitacit
dvě dlaně spojené, ze kterých můžu pít.

Stébélko trávy z louky za lesem,
co k smíchu nutí mne, když šimrá pod nosem,
nad hlavou napořád kus modrého nebe…""
Paní šla k regálu…  vytáhla.. Tebe"
111,Chtěla bych,úterý 24. září 2013,"Chtěla bych
být Tvou první myšlenkou,
když s ránem otevřeš oči,
fialkou i bílou sněženkou,
z jichž vůně hlava se Ti točí.

Nemyslet na sebe.. jen plout
na vlnách Tvého chlapeckého hlasu,
nikdy nenechat vyblednout
Tvé oči lesklé od úžasu,

z Tvé tváře sfouknout řasu,
jak bychom nebyli dospělí,
být přítelem na dlouhou trasu
a osladit Tvá pondělí …

milion tichých vět Ti říct..
já…chtěla bych být víc…"
112,Dnešní noc,pátek 20. září 2013,"""Až v noci všechny hvězdy spadnou,

nevidím – oči mi páska zakryla.
Jen k ránu protřepu peruť chladnou,
jestli tam přec jedna hvězdička nezbyla.""

""Dnes hvězdy tančí hledaje své cíle.
Rozleť se za nimi, užij té chvíle,
pozoruj stopy, co kreslí jasem,
dívej se potichu, šetři teď hlasem.""

v kooperaci s @cotomate"
113,Káva,čtvrtek 12. září 2013,"U ranní kávy s výhledem na zahradu
objímám kolena a podpírám si jimi bradu
dvě slané slzy do hrníčku skanou
dávám ho stranou, já nechci kávu slanou

S úsměvem mi tu svoji kávu přistrčíš
ještě ji cestou trochu dosladíš
Povíme si všechny ranní zprávy
– Ty jsi můj pravý šálek kávy…"
114,Křeslo,pondělí 16. září 2013,"Křeslo na zahradě, kde vánek mi vlasy zacuchal
zůstalo opuštěné, jak poslední letní den ho zanechal
pomalu půjdu a uklidím ho radši…
vždyť pouhý pohled na něj nutí mě k pláči"
115,Léto,pondělí 9. září 2013,"Voňavá, něžná jak milostná věta,
čerstvá a hebká šeptala v trávě.
Sváděla… Ty vzal sis ji hravě.
Růžový květ – poslední dotek léta."
116,Mosty,úterý 24. září 2013,"Mezi lidmi nejsou mosty
snad kdysi byly
to oni sami si je pobořili
důvod byl prostý
zvyk snoubený se samozřejmostí
možná pět deka nedůvěry
na vlastních duších zpronevěry
strachu a smutku dosytosti

Můj most, má lávka, pomalu se bortí
kamínek za kamenem opadává
dole na dně už stydne i láva
v dálce na mě kdosi mává růží z pouti
a do mé duše, do zákoutí
plazí se samota, to hádě
kroutí se jako na estrádě
za zvuků flétny usmívá se z koše z proutí

Tak úzkost líbá mě a objímá mě dlouho
a vím – já nejsem výhrou pro nikoho"
117,Na konci,pondělí 9. září 2013,"Ani sis nevšiml, že já už tu nejsem dál
Vzdávám se výsad, cos mi dal
Jsem znavená, ty´s hledač pokladů,
co srdce mi kdysi ukradl
Na konci léta, zbavená iluzí,
tak lehká… už nic mne nemrzí
Když zdálo se, že mnoho mne nečeká
věci se děly – na konci cesty našla jsem člověka
a zahlédla jsem kousek jeho nebe…
na konci cesty v něm našla jsem sebe"
118,Nad domy,pondělí 23. září 2013,"Dorůstá bílý měsíc nad domy
na něm jen těžko viditelným krasopisem
přibývá psaní, připlouvá ke mně – moje svědomí
než vybledne k ránu, zazáří jako tečka za dopisem

Poslední vážka usedla na kapku rosy
pak slétla na Tvé rameno a zašeptala cosi
Ty ve spánku ses tiše pousmál
a noc se rozzářila jako svatý grál"
119,Noční kouzlo,pondělí 23. září 2013,"Co do snů přát vám dnes?

Co poslat do polštářů a podušek?

Klavíru vnořím prsty do kláves,

nebem se vyrojilo moře světlušek

Rybník rozzářil se v nočním svitu
odlesky mušek dopadaly na hladinu
jak odraz očí plných citů
podobný hvězdami protkanému gobelínu

Pak u hladiny mihla se bělice
jak malá mořská víla
oděná  byla jen měsícem,
na vodě stříbřitá kola zbyla

a vrby s vlasy u pasu
hleděly v němém úžasu…"
120,Odvaha,pátek 20. září 2013,"Odvážím čtvrt kila
naděje – aby byla.
Aby jí bylo dost,
až půjdu pro radost.
Odvahu navážím
a až se odvážím,
z oblohy hvězdy smetu,
pak sáhnu za kometu,
vytáhnu sny ztracené,
ty jsou jen pro vás určené…"
121,Ohňová země,středa 11. září 2013,"Jsi oheň, já jsem země
klidná a spící,
však, když dotkneš se mě,
mé srdce tepající

vlije mi do žil žhavou lávu
a trasy, které jindy nepřeplavu

zdají se být snadné
když u kormidla stojím, ruce zebou
a nikdo už mi neukradne
všechny ty chvíle s Tebou

Na cestě kolem světa Ohňovou zemi      pokořím,
pak do ucha Ti černou perlu zavěsím"
122,Plejády,sobota 28. září 2013,"Korunu z noční tmy utkanou

teď nasadím si jako král

Mléčná dráha se zalije smetanou

proběhl po ní Pegas a potichoučku ržál..

Překonal všechny vesmírné příkopy

chtěl k pramenům té záplavy pozdravit najády

Prolétl tryskem, až hvězdy létaly od kopyt

a z těch hvězd se pak zrodily Plejády…"
123,Pozlátka,pondělí 30. září 2013,"Žongluji s písmeny jak cirkusový akrobat
jak kovář snažím se pro Tebe ukovat
příběhy z jasných hvězd a spousty něhy
příběhy, ve kterých nebudou břehy
Ukrývám polibek za každou hlásku
za čárky a háčky vysadím sedmikrásku
Abys sám nemusel luštit text tam a zpátky
pojď, naučím Tě číst mezi řádky
Vkládám tam slůvka jako cukrátka
Budem ta sladká slova jíst a odhazovat pozlátka"
124,Příteli,pátek 6. září 2013,"Zlatavé lány pšenice se vlní,
mezi nimi pole heřmánku,
vzduch plný letních vůní,
jež s večerem mi voní do spánku

Divíš se žlutým diviznám,
vždyť divizny jsou k divení
a když se v cestách nevyznám,
tak čekám na Tvé znamení

Létáme spolu jako ptáci
sametem, kam až oko dohlédne.
Potom se zpátky na zem vracím,
často až v pravé poledne

Uprostřed pole řada stromů
jak karavana velbloudů
a nikdy se mi nechce domů
plyneme spolu po proudu

Příteli – jdeš se mnou úvozem – mým osudem..
a nevím, vážně nevím, co bude, až spolu nebudem
pročešeš kopyty obilí, ucítím vůni řebříčku,

z dob čínských císařů můj zlatý nebeský koníčku.."
125,Zlehka,úterý 17. září 2013,"My, lidé, za maskami jsme skrytí,
bolest v nás překryjem úsměvy
zatímco v očích se nám slzy třpytí.
Cítíme váhavé záchvěvy,

když zahlédneme v dálce člověka,
a v jeho pohledu zářící hvězdu,
zdá se pak u konce cesta daleká,
ruce nám zkamení v němém gestu.

Je třeba potichu naslouchat,
člověk je bytost křehká.
Nesoudit, dívat se, nespěchat
a v duších našlapovat zlehka…"
126,Vím..,čtvrtek 5. září 2013,"Jednou se moje hladké tělo
Tvým horkým rukám omrzí.
Prstům, pod jejichž dotyky se chvělo,
můj prodavači iluzí.

Až pod dekou se k sobě v noci obrátíme zády
a mezi námi plno nevyřčených vět,
pak zhořkne Mléčná dráha z čokolády
– je jednosměrná, není cesty zpět.

Tak tedy alespoň dnes v noci
drž ve svých dlaních moje zkřehlé ruce,
když s rozumem jsem v koncích,
zahřej mé osamělé srdce…"
127,Anděli,čtvrtek 10. října 2013,"Myšlence zasuté v paměti se říká zapomnění
málem jsem zapomněla, jak zvolna plyne řeka
když někdo kdesi je, kdo za celý svět Tě nevymění
kdo v batohu Tvou víru nosí a když se zpozdíš, čeká

Jak pod křídly racků pod Tvou ochranou si plout
zahlédnout z pod mraků všechny světa krásy
pod hvězdným nebem Tě pevně obejmout
můj strážný anděli, můj anděli spásy…"
128,Bezvětří,pondělí 28. října 2013,"Moje loď nepluje
vítr plachty nenapíná
život se zastavil, pózuje
marně se mu vzpírám

Dvě bílá křídla ptačí
hladinu moře rozčeřila
jen dvě slova stačí
mi, abych uvěřila

Stojíme blízko sebe
slyším jen jeho tichý dech
pod jasným modrým nebem
s odlesky léta na listech

Myslím, že chtěla bych příliš mnoho
chtěla bych být vším – pro někoho"
129,Divoké husy,neděle 13. října 2013,"Když on a ona letí spolu,
stříbrné křídlo vedle křídla,
nedívají se na zem dolů
a prý se splní sny prýštící z nitra.

Pár divokých šedých husí
odlétá podzimní oblohou,
vyplnit jedno naše přání zkusí,
naše sny žít za nás však nemohou.

Pak z divokých hus v oblacích
zbude jen třpyt jejich peří.
Ony až s jarem se navrací.
Přinesou nové sny.  Věřím…"
130,Mží,neděle 20. října 2013,"Všechno jen lži

ve spirále snesla jsem se dolů

za oknem mží

už nikdy, nikdy spolu

Jak barevné listí

Tvoje vzkazy na plotě

obsah už nezjistím

teď, ani v příštím životě"
131,Neumím..,pondělí 21. října 2013,"Slova a gesta.. ach.. neumím se chovat,
být vzorná a etiketu dodržovat
a přitom jediné, co jsem vlastně chtěla,
když vážka z listu neslyšně odletěla,
abys mi shrnul vlasy z čela,
prsty z nich vyhnal ptačí peříčka
jen.. zlehka políbit Tě na víčka.."
132,Obyčejná,čtvrtek 17. října 2013,"Jak na podzim spadlý list
jsem příliš obyčejná pro tento svět
barevných blyštivých pozlátek.
Neumím v Tvém srdci číst,

jsem jenom malá šedá myš,

o které na svých cestách těžko sníš.

Nevzdám to snadno.
Dál míchám lektvary lásky
(často už jenom pro bělásky),
hustím je solí a dívám se na dno,
vařím je z citů a minulých chyb
a doufám, že snad bude líp.

Neznám svou roli ve Tvých hrách,
ač nohama stojím na podlaze,
mé srdce pluje na oběžné dráze
ve vzduchoprázdnu, kde zbyl jen hvězdný prach.

Za deštivých večerů cítím, že nežiji…

Alespoň dnes v noci být tak Tvou Julií."
133,Ostrovy,neděle 6. října 2013,"Lidská touha tiše proplouvá
mezi ostrovy lásky a míří k cíli.
Některý mine, jinde zacouvá,
tak šťastnou plavbu, moji milí!

Já tady jako pirát hladový
hledám svůj ostrov dosud spící.
Někdy mi štěstí nesou náhody
a směr určují lodě kličkující.

Teď stačí najít správný plánek,
na kterém z ostrovů je pravý dar.
Moře je nekonečno slánek
a vzácných perel je jen pár.

S pomocí @DrakulkaCZ"
134,Paprsky,středa 23. října 2013,"Ve slunečních paprscích skrytí,
oslepená odlesky v jeho očích,
ve kterých souhvězdí se třpytí
a netuším, jak zaútočí.

Jen matný otisk jeho tváře
na pokožce mého ramene,
vším může být bez ztráty svatozáře,
ukrývám pohledy zmatené.

Stokrát jsem slunce přeletěla
na svých pyšných křídlech a neztratila pel.
Jedenkrát zkouším se dotknout zcela,
vím, sežehne má křídla na popel."
135,Pláč,pondělí 7. října 2013,"Bezmocný pláč až do svítání
otisky na okenních sklech
hořící srdce v dlaních
Tvé jméno na mých rtech

Slzy hořké jak pelyněk
ze rtů Tě nesmývají
polykám ten divný lék
jed ze starých zašlých bájí

Pak, když slunce vejde tiše
neslyšně otevře oblohy vrátka
zhluboka připije mi z číše
básnířko bosá, na to jsi krátká…"
136,Volavky popelavé,čtvrtek 10. října 2013,"Bez Tvých slov se den vleče

každá vteřina ze mě odplavuje cit
Tvůj pohled na duši mě svleče
v těch očích chtěla bych se utopit

Srdce hoří, krev se v žilách pění,
však příliš rychle vzplálo, pozdě hledat lék
a srdce doutná, pomalu se v popel mění
pak už jen vzlétne jako hejna šedých volavek"
137,Pozdrav,úterý 22. října 2013,"Léto nás ještě dnes pozdravilo,
s barevným listím si zatančilo,
usmálo se a v tváři mělo dolíček,
i andělé oblékli se do triček.

Kytice barevného listí
podzim pro zimu vzduch čistí.
Na chvíli svět zastavil se v snách
a já tu stojím s blátem na botách."
138,Proud,sobota 26. října 2013,"Dívám se, jak tiše spíš..

na kůži přitisknu rty – pohneš ramenem

vidíš mi do srdce – jenom Ty smíš

probdělé noci dávno jsou splacené

Kdo jsem já? Jen list, jenž klouže po hladině

splyne s ní, odpluje po proudu – moje duše

nejdřív se na vodě houpe líně

pak po kamenech rychle kluše

Po odehrané epizodě

když už svou vlastní tíhu neunese

v té chladné hebké vodě

na konci své cesty.. rozplyne se"
139,Setkání,čtvrtek 17. října 2013,"Hvězdy se setkaly a klábosí,
co které se dnes bude zdát.
Utichnou až k ránu za rosy,
na trojlístku si spočítám, jestli mě máš rád.

Jejich c  inkání do uší
je tichoučké jako zpěv motýla,
s večerem pohladí na duši,
když něha Tvá někam se ukryla."
140,Slova,pátek 25. října 2013,"Občas, když hvězdy s nocí
roztáhnou svoje sítě,
v souhvězdí Labutě zahlédnu
zastřený nápis ""Miluji Tě""

A vždy, když Deneb vidí tato slova
z oblohy shlédne – zvědavost jí nedá
tváře jí zrudnou do nachova
i když je jinak velmi bledá..

Rukama podám si ta něžná slůvka

a hvězda závistí zas zbledne

v noci je vidíme já i ona,

však jen moje jsou ve dne…"
141,U krbu,sobota 5. října 2013,"Noci nenápadně přibývá,

měsíc se vypravil na potulku.

Pohladí hvězdy, pak jim zazpívá

a před spaním zapálí si lulku.

Ty zapal v krbu oheň, ať hoří
a přihoď ještě polínko,
budu dnes královnou sedmi moří,
sklouzne mi od šatů ramínko.

Pak cestou ve vlasech
vydáš se prsty na výpravu,
já poškrábu Tě na zádech,
už zase Tě mám plnou hlavu."
142,Díky,sobota 30. listopadu 2013,"Díky, že jsi, že mě držíš zkrátka
vidíš mě nahou, bez pozlátka,
že stojíš tam, kam padám
a mlčíš, když se hádám.
Že mě rozesměješ, když mám strach
a marně bloudím v pochybách.
Občas však trochu váhám
v očích mě slzy tlačí
rukama na duši sahám
a nevím, o co kráčí.
Jsi blázen, když si myslíš,
že mi stačí
noc co noc znavená
usínat na bodláčí…"
143,Otázky,pondělí 4. listopadu 2013,"Kolik tak váží moje touha,
a jak je pevná moje víra,
když noc za nocí je dlouhá,
když denně srdce úzkost svírá?

Což nevíš – žádat lásku anděla
sváže mu křídla docela?
Proč jsi jak tvrdohlavé dítě
říkal to něžné ""miluji Tě""?

Bojím se lží ze soucitu
a hlavně ničím neublížit
neklidný spánek do úsvitu..
Co já? Jen polknu, vzhlédnu k mřížím

které mi nedovolí letět.
Proč jen já musím vědět,
co jiní vědět nechtějí?
A co když ubližuješ nadějí?

Co uděláš, až ocitne se
její tvář nablízku té Tvojí?
A budeš vědět, že jen pohlazení
muže v lesklé zbroji,

že jen políbení její vášeň zhojí?
Co uděláš? Přijmeš pod obojí?
Mám strach, že dlouze políbíš jí ústa
a ona zašeptá jen: ""Zůstaň..""

Já za sebou pak zavřu tiše dveře,
už nikdy více nenechám se z cesty svést,
utopím se ve své nedůvěře,
už nikdy nechci dotýkat se lásky jako chladných hvězd.."
144,Ruce,úterý 19. listopadu 2013,"Zdalipak víš, jak voňavé
hladké jsou Tvoje ruce?
Na hřbetech chmýří zlatavé
jak proužky slunce na antuce.

Ještě mi teple dýcháš na záda,
mé vlasy zlehka vískáš.
Nepřiznávám to nerada –
mně už se dávno stýská…"
145,Slunce,úterý 26. listopadu 2013,"Nad moře k slunci vzlétnout
letět nad bílou pěnou
nad hladinou pokaždé jinou
a přitom nezměněnou

Tys moje slunce, před nímž klečím
a které nikdo nezastíní
neboť jen Ty rozumíš mé řeči
jenom Ty vidíš, co míjeli jiní

Před Tebou skláním hlavu a skládám zbraň
jen Ty smíš vnořit své prsty do mých ran"
146,Šplouchání,středa 13. listopadu 2013,"Když ztichne den, v temném pokoji
noc co noc pod mojí peřinou cosi šumí
to moje srdce koupe se v příboji
slyším jak jeho    údery   zpěněná krev tlumí

Tichoučké šplouchání vln do spaní
cítím až sem slanou mořskou vůni
chci utopit se ve Tvém šeptání
a ve Tvých očích jako v tůni…"
147,Strach,úterý 12. listopadu 2013,"Snad vrátíš se ještě,
princi můj na bílém koni,
jenž v  provazech deště
pokorně hlavu kloní.

Čekám tu na Tebe – věrná,
stojím za oknem, hvězdy blikají.
Noc byla černější než černá
a první ptáci v parku zpívají.

Napínám uši – chci slyšet klapot kopyt.
Ty se však ztrácíš v prachu.
Necháš mě v klidu hořkost dopít.
Necháš mě napospas mému strachu…"
148,Svatomartinská,čtvrtek 14. listopadu 2013,"Svatý Martin chystá se do polí
od koňských podkov hvězdy mrholí
jiskří a potichu blýskají se
v oranžovém svitu lampy u silnice"
149,Talisman,pondělí 11. listopadu 2013,"Tolik se na Tebe těším, tolik mi scházíš
Nepočítám večery, kdy do snů mě doprovázíš

Už teď se mi stýská po časech, které nenastanou
tiše Ti mávám, Lásko, mávám na shledanou

Budeš mít ještě mnoho ženských těl, než probudíš se stár

snad Tvoje dlaně nevychladnou, neztratí všechen žár

Pak Tvé ruce spočinou na mých hladkých ramenou
Bože, dej, ať potom navždy tam zůstanou

Však ještě  bez sebe budeme sami snídat mnoho chladných rán
do té doby snad schováš mě v srdci svém jako talisman"
150,V mlze,pátek 15. listopadu 2013,"Zahrada celá v bílé mlze,

jak v krajkách z mořské pěny.

Otevřu okno, zhluboka   nadechnu se,

zašeptám – v krajce je díra od ozvěny..

A možná je to jenom finta,
pojednou z mlhy hejno racků stoupá

– jak přízrak – loď kapitána Flinta
v mé zahradě se houpá.

Mořského vlka, myslím, budu znát.
Pod bílým vousem usmívá se,
v košilce dovolí mi u kormidla stát,
snědýma rukama mě chytí v pase."
151,V mracích,sobota 30. listopadu 2013,"Vysoko v mracích spí náš hrad,
v něm zlatý trůn a Ty jsi samet.
Čekáš tam na mě…
…. máš mě rád?
Často se s ránem plížím na med.
Vyhnu se konečně chybám?
Proč šeptám v tichu pokoje,
když Tě tak horečně líbám,
že vše, co mé je, Tvoje je?
Jsem Tvoje celá, Ty to víš.
Co zdává se Ti asi?
Zatímco v klidu sladce spíš
sleduji Tvé chvějící se řasy…
…
Jsem jenom malá lesní včela,
bojím se výšek, trpím závratí.
Kdybych snad někdy uletěla,
tak se už nikdy nevrátím…"
152,Víla,čtvrtek 7. listopadu 2013,"Za noci dešťové kapky ťukají do oken
v rytmu mých rukou tančících v klávesách
Prsty se dotýkat souhvězdí zlehka jen
těch hvězd jako zrníček písku  na dunách

V košilce víla stojí na zápraží
dívá se do tmy – podzimní déšť trochu zebe
zářící vesmír objímá hladkou paží
a mýma rukama obejme pevně Tebe."
153,Život,úterý 19. listopadu 2013,"Stárneme a v ústech verše s námi
mění se, mutují, na cestě pustinami
v ústech usychají sliny
my stárnem sami, i když s nimi

Stárneme a s námi naše řádky
a někdy není chvíle
ohlížet se zpátky

Stárneme a s námi naše básně
pomalu šednou
i když dřív nám zněly krásně

Stárneme a také naše lásky
a někdy celá léta
zdají se být smutná

A všichni víme
– bez nadsázky –
že o to víc nám život chutná…"
154,Až,pondělí 16. prosince 2013,"Až budeš sám,
až budou padat vločky
na okenní rám,
až políbí Tě první noční
hvězda na čelo –
jako já,
až ucítíš, že jasné nebe
ztemnělo,
až běloučký den zahalí se
v plášť,
vzpomeň si na mě,
na moje oči
a na to, že mě máš…"
155,Bůh,sobota 14. prosince 2013,"V mlhovině znavený po další ze svých cest
odpočívá, louská jádra hvězd
Mé rozpraskané srdce vidí
Bůh – obyvatel suterénů a lidí"
156,Hotel na měsíci,úterý 31. prosince 2013,"Sleduji tajemný pětník v černé obloze.
Tváře mu zbledly, jak by je kdosi polil mlíkem;
někdy se skrývá za mraků přehozem.
Tam vlevo, kousek nad rovníkem,

to není jenom tečka, to je víc,
vždycky, když koukám na Měsíc,

vidím tam nápis písmem zvláštně skloněným
navždy do kamenného pláště vrytý,
září tam pro mě jasnými písmeny,
ačkoli hvězdářům je skrytý.

O krasopisu na Měsíci často zdá se mi,
když v oknech zhasnou světla svící.
Kdybych snad nenašla své místo na Zemi,
tak mám svůj malý hotel na Měsíci.

Místečko pro sny, zapomnění a něžný hvězdný déšť,
místo pro návraty a cokoliv si vzpomeneš…"
157,Maják,neděle 8. prosince 2013,"Jednou, až jejich hvězda zhasne,
pak mořské víly promění se v pěnu.
Zůstanou pro svět i tak krásné..
navzdory tomu přesmutnému věnu

V podobný den duše námořníků dostávají křídla
a v hejnech racků křičí za zádí,
mávají perutěmi bílými jak křída,
před nebezpečím varují, či jenom v slaném větru dovádí

Jeden z těch racků nad mořem si nezakřičí,
jeden tu chybí, nikdo ho nechytí.
Místo něj – uprostřed vln se maják hrdě tyčí,
zažehnu uvnitř oheň a on se do tmy tiše rozsvítí…"
158,Nocí,pátek 13. prosince 2013,"Zchladit si horkou hlavu
srdce jako lávu
Ulicemi nočního města zpaměti.. ze zvyku
Přehlušit tíseň, pořádně osolit muziku

Pomalu potom zchladit lávu
Lehnout si, usnout, ráno vypít kávu
Hrníček hodit do zahrady na jinovatku bílou
a střepy srdce zkusit slepit – pokud něco zbylo…"
159,Peřeje,čtvrtek 12. prosince 2013,"V podzimních peřejích
milion kapek půvabu
To nejsou moje sny, co ke dnu se snášejí,
to jsou jen černá pírka čápa marabu."
160,Pláč,neděle 15. prosince 2013,"Tlumené vzlyky pod dekou
tlukoucím srdcem jenom neprobudit den
před sebou ještě cestu dalekou
pro předem nesplněný sen
vlasy barvy vybledlé svatozáře
prsty v křeči zabořené do polštáře"
161,Pod jmelím,pátek 20. prosince 2013,"Sněhové hvězdy tma rozsvěcí
Ve vánočním království zimy
všechno se může stát
Stýská se, ale chci zůstat nad věcí
Budu si večer pod víčky
šeptat: Má mě rád…

Odevšad slyšet je zvonků zvonění
Zlatavým jiskřením jehličí ševelí
Celý dům lesem se provoní
Lásko má, chtěla bych polibek vtisknout Ti pod jmelím…"
162,Podzim,čtvrtek 5. prosince 2013,"Těším se na sněžení listí,
co padá z dubů, z buků,
na první rozbřesk, rozednění,
na rána plná ptačích zvuků
na Tvoji tvář,
až moje řasy otevřou svá vrátka,
sluneční zář,
která je na podzim tak sladká.
….
S Tebou mám ráda
i studivý listopad.
Zima se nenápadně vkrádá,
to Tys mě učil mít ho rád.
…
Až objeví se v polích první sněhy
a ztuhlá zem se k spaní uloží,
otevřeš pro mě dlaně plné něhy,
oheň se v krbu teple rozhoří.
Budeme spolu čekat jaro
a každý rok se láskou prozlatí.
Můžem to rozjet plnou parou,
i kdyby chudí, budem bohatí…"
