id,title,date,content
1,Skok,úterý 20. listopadu 2012,"Jsem. Snáším se k zemi. Jsem sněhová vločka.
Ze všech sil volám, ať ohlédne se, počká.
Prochází mnou jako stínem a neví. O něm jsem snila.
Rozpouštím se v kaluži špíny jak malá mořská víla."
2,Holubi,středa 30. ledna 2013,"Nad domy vzneslo se hejno holubů.
Slyšíš, jak šumí jejich křídla?
Sníh ušil na střechy bílou obrubu,
oni klouzají, jako by vítr byl z mýdla.

Zašustí do ticha letka holubí,
jak na povel naklání se a krouží,
holubí bříška se blýskají, jsou sehraní
a jejich obraz odráží se v loužích.

Opíšou třikrát mou svatozář nad hlavou,
k zemi se snášejí peříčka šedá.
Něco si přej, já stojím tu s obavou,
že mé tajné přání splnit se nedá.

Potom se šumění s deštěm smíchá
v tichoučké staccato a já už vím,
za měsíčné noci uprostřed Moře ticha
sama se v slzách utopím."
3,Bílý anděl,sobota 26. ledna 2013,"Malá bílá pírka poletují vzduchem
toužím je mít v perutích
však ve vesmíru hluchém
slyším jenom smích.

Plujeme Mléčnou dráhou každý sám
můj bílý anděl zářící se toulá v dálavách
v rukou svých svírám talisman
ať na cestách mi aspoň zamává.

Ať pošle aspoň pozdravení
ten bílý něžný lhář
pak dojde mi, že žádný není
a černým křídlem zakryji si tvář."
4,Dospívání,sobota 26. ledna 2013,"Stejně, jak se člověk rodí
s dědičným hříchem,
andělovo černé peří
splývá s nočním tichem.

Dostane je na cestu,
vybaven tak přírodou,
že se má stát andělem,
pochopí až náhodou.

Když ho někdo požádá
o pomoc a lásku,
musí jít jak voják,
přes oči černou pásku.

Strachem téměř nedýchá,
vše vsadí na kartu jedinou,
musí chránit svého člověka,
neztratit duši nevinnou.

Tak učí se být andělem,
časem černá pírka ztrácí,
když člověka šťastným udělá,
jak frčky bílé peří se mu vrací."
5,Mléčná dráha,úterý 29. ledna 2013,"Jsou na Zemi hvězdáři,

kteří slepě věří,

že co se v Mléčné dráze odráží,

jsou hvězdy a ne peří.

Já znám však kluka, co se tváří,

že vesmír je plný pírek andělích,

To jeho oči z Mléčné dráhy září.

To vím zas já: oči a jeho smích.

Kdybych však přece pochybila,
váhání mě přepad stín
a skutečně tam kupa peří byla,
můžeme skákat v Mléčné dráze do peřin."
6,Noc,pondělí 28. ledna 2013,"Dnešní noc bude stříbrošedá
jak saténová košilka,
večerem voní levandule
a taky trochu vanilka.

Na parapetu svíčka bliká,
sny ke mě kráčí čarokrásné,
do spánku mi hbitě vplují,
až její měkké světlo zhasne.

Dnešní noc bude něžná
jako ramínko u tílka
a sladká jako čokoláda
a snědá jako Brazilka."
7,Okno,čtvrtek 31. ledna 2013,"Okno je příslibem nových světů,
za ním je život, tma i zář,
ruce si chladím sklem plným zmrzlých květů,
pod krempou klobouku zahlédnu bledou tvář.

Jen okamžik a zmizí do noci,
láká jak tajemná bludička
do tmy, ze které zírají žraloci,
chvěje se ve mě maličká dušička.

Chvěje se jak malý plamínek,
tvář mi připomene kohosi
z mých dávných něžných vzpomínek,
kdo už ten klobouk dávno nenosí.."
8,Pravá,úterý 15. ledna 2013,"Jak se pozná ta má duše pravá
v hlubokém temném vesmíru,
když rozum za srdcem pokulhává
a každý hledá lásku jenom z plezíru?

Je to ta duše, která se mnou brečí,
když potoky slz moje šaty skrápí?
Nebo ta, která zvedne mě, když klečím,
když svět mě zraňuje a trápí?

Či snad jen někdo, kdo mi rozumí,
kdo myslí na mě občas s půlnocí,
krok ke mě udělat však nemůže, či neumí,
mé srdce od lásky si nedá pomoci."
9,Srdce,úterý 29. ledna 2013,"Okno je brána
spojení dvou světů
vstup do kalného rána
srdce z vosku hnětu

Okno je černá díra
za ním cizí galaxie
v kterých se neumírá
kde se věčně žije

Okno mě kolébá do spaní
spánkem proklouznu k svítání
nezlomí se a nezraní
mé voskové srdce na dlani"
10,Bohové,středa 6. února 2013,"Bohové vrhají kostky
v nejnepříhodnější čas,
zda chceme býti hráči,
neptají se nás.

Z vězení vypouštějí lásku,
která ničí nebo tvoří,
mnohá srdce zmítaná
tou láskou choří a mnohá hoří.

Tak vrtošivý vítr zanesl ji k nám,
je tady, zastavil se čas.
Plamen srdce chvěje se
a potom zase hoří v nás."
11,Hodinky,pondělí 4. února 2013,"Sametová noc je tichá
i budík jenom zlehka dýchá
a netopýři ke startu připraveni
vyšlou signál, čekají na znamení.

Dnešní noc sladká je jak pralinky,
nekončí, snad zapomněla hodinky.
Měsíc se usmívá jak dortík z marcipánu,
obloha plná hvězd jak žlutých tulipánů."
12,Hořká,sobota 23. února 2013,"Když souhvězdí jsou skryta v mracích,
to pláče tulák po hvězdách.
Právě se ze svých výprav vrací
a ve vlasech má hvězdný prach

Když on je smutný,
zhořkne mléčná dráha z čokolády,
marcipán planet přestane být chutný
a komety se obracejí zády

Až ze svých poutí bude zpátky,
až vypláče se z jeho bolu,
přijdu mu naproti vesmírnými vrátky,
tu hořkomléčnou dráhu sníme spolu"
13,Kouzlo,pátek 1. února 2013,"Kouzelnou hůlku má
bloudí s ní po hvězdách
ta bytost tajemná
ve vlasech hvězdný prach

Snad jednou, znavený
svou cestou, klidu se naučí
vesmírné zahlédne znamení
anděla vyhledá, usne mu v náruči

Zůstane v objetí světelné roky
načerpá síly, jež mají jen vyvolení
až k hvězdám dalekým stočí své kroky
čeká ho okamžik překvapení

Zatímco spal, zmizelo kouzlo navždy
hůlka je prach, on zmatek má ve tváři
prstem se dotkne pohaslé hvězdy
ta pod jeho dotykem náhle se rozzáří"
14,Město,neděle 10. února 2013,"Za nocí kráčím po střechách
pokrytých pálenými taškami
město je plné siluet domů
a temné nebe nad námi

Město poskládané jak origami
je tiché a svítí do daleka
proudy světel vlní se
jak hladina a její řeka

Sedám si za komíny a
ohřívám si ruce zkřehlé
pak pohne se cosi
v domě protilehlém

Tam v přítmí svíček za  oknem
kde na parapetu vločky tají
stojí dva stíny – on a ona,
stojí tam spolu a rty se zlehka dotýkají."
15,Polibek,sobota 2. února 2013,"Andělům souzena tělesná láska není
neznají sladkost políbení
znají však lásku, kterou častokrát
duší se na dálku smějí dotýkat.

Když anděl člověka v myšlenkách políbí
svou pomoc navždy tak přislíbí
v jediném polibku spolu pak vzlétnou
aniž se kdy jejich rty střetnou."
16,Puzzle,čtvrtek 21. února 2013,"Svět je plný rozházených dílků
skládanky našich dnů
plný na kolena padlých snílků
kladoucích k sobě střípky snů

Skládáme pomalu i chvatně
každý dle svého obyčeje
skládáme od krajů, někdy matně
a někdo skládá jenom obličeje

Někdo dle návodu a někdo podle fantazie
někdo skládá poslepu a někdo od srdce
obrázek pohne se a vlastním životem si žije
někdo staví podle plánku k jiné skládance

Někdo potřebuje přesné instrukce
skládáme životy z příběhů i věcí
aby dílky zapadly do pevné konstrukce
přitom my všichni jsme stavitelé křehcí

A já až v tichu dnešní noci vím,
co v mém obrázku jasným písmem stojí
že Ty jsi voda na můj mlýn
Ty jsi chybějící dílek do té mojí…"
17,Strážný anděl,neděle 3. února 2013,"Když anděl síly ztrácí,
když k ránu do světa se vrací,
ve kterém nic ho nečeká,
někdy se stane, že potká člověka

Očima zamrká a řasami
rozvíří vzduch nad jejich hlavami,
jejich pohledy se potkají,
beze slov spiklenecky šeptají

Anděl pak přestane se bát,
můžou se spolu smát a hvězdy počítat
a člověku může stát se údělem
andělu býti strážným andělem :)"
18,Bez názvu,čtvrtek 21. února 2013,"Vodě hladkost
Ptákům volnost
Andělům lásku"
19,Tulák,středa 20. února 2013,"Málo ho vídám
marná sláva
zahlédnu jeho stín
za druhou hvězdou zprava

Zamává na mě
svou bílou dlaní
něžné sny vklouznou
do mého spaní

A mléčná dráha z hvězd
upečených dozlatova
ta dráha copatá
věčného tuláka zase schová"
20,Ukolébavka,čtvrtek 7. února 2013,"Anděl spal dnes na hladině
oceánu Mléčné dráhy,
přikrývkou mu hvězdy byly,
hřály a on spal tam nahý.

Kolébal ho jemný vánek,
oblékl ho do peří,
trochu pírek slétlo na Zem,
smutný ten, kdo nevěří."
21,Sněžení,středa 6. února 2013,"Vločky dnes něžně mrholí,
každá je jiná docela,
padají na chodník a taky do polí,
v každičké jedné je přání anděla.

Lidé k nim tváře zvedají,
snad poselství v nich tuší,
vločky jim na řasy sedají,
každému plní sny a moc jim sluší."
22,Kapky,neděle 10. března 2013,"Dvě kapky na zábradlí lesknou se, každá sama
Každá je sama, snad dočkají se rána
V sobě se navzájem zrcadlí
Na černém kovovém zábradlí
Do svítání vteřiny se vlečou
Než v jedinou kapku stečou
Ta potom ztěžka skane dolů
Ve věčném objetí dvě kapky umřou spolu
A jestli neumřou, vytvoří základ řeky
Která rozemele hory a poteče věky
Možná ze zajetí řeky se pak kapka vysvobodí
Až dosáhne chvíle, kdy hroutí se staré světy a kdy se nové hvězdy rodí."
23,Když spíš,úterý 12. března 2013,"V myšlenkách snesu se na Tvoji peřinu,
Tvé oči zavřené jsou cílem, jejž neminu.
Znám je tak dávno, jak se točí Země,
chci hýčkat Tvůj spánek a víčka líbat jemně.

Šeptám Ti slůvka, co říkat se nemají,
nemůžu za to, ze rtů mi létají.
Sníš klidně, jen vráska na čele
občas se usměje ze spaní vesele.

Tisknu se k Tobě, šimráš mě na nose,
odraz nás dvou smím hledat jen v obloze
nebo na průzračné jezerní hladině.
Hodíš tam oblázek a obraz se rozplyne…"
24,Kolibřík,středa 20. března 2013,"Jak rychle tluče srdce kolibříka?
Jako když nocí budík tiká?
Nebo zní jako mojí duše chvění,
když krev se v žilách náhle zpění,
a utišit ji možné není?

Jak rychle kmitá srdce kolibříka?
Jako když na obloze hvězda bliká?
Jako když pod palcem mi listy běží
a oddychují knížky vůně svěží?
Jak dusot kopyt koně bez otěží?

Jak asi rychle mžiká
maličké srdce kolibříka?
Jak moje řasy, než z nich slza steče,
když chvíle bez Tebe se vleče?
Malý ptáček květ svou krásou přiobleče,

nad hlavou zase jasná hvězda bliká,
můj znovu nalezený úsměv říká:
Poznáváš? To jsem já v srdci kolibříka…"
25,Láska,neděle 24. března 2013,"Jsi měsíc, stříbrný peníz
v temnotě noční oblohy,
úchvatný obraz
stvořený bez modelu, bez předlohy.
Jsi z režného plátna měšec
plný barevných fazolí,
voňavá skořice, která můj pláč
zázračně prosolí.
Jsi peří ptáků, když ve větvích
usínají znavení,
s nosem přitisklým na sklo
pokorně čekám,
až dáš mi znamení.
Žiješ z dešťů mých slz,
které jak višně kanou k rtům,
má ústa tiše sládnou,
jsou náchylná k polibkům.
Zanecháváš mě v bouři
Tvým trnem poraněnou.
Jsi svátost, lásko, nenech mě zemřít,
já přijímám Tě na kolenou."
26,Motýl z Maranella,pondělí 11. března 2013,"Jak chutnají Tvoje rty?
Už skoro jsem zapomněla…
Jaké je padat do propasti,
poddat se Tvému tělu zcela
a neovládnout slzy slasti..

Nevím, kdy dotknu se,
byť letmo jen, Tvých dlaní,
kdy zády se k Tobě přilepím,
když se ke mně skláníš,
kdy bude to, co já vím?

Večer jsem usnula v zahradě.
Otřu si kapky rosy z čela,
do vlasů vpletu věnec z trávy.
Usedl na něj motýl z Maranella,
snad přinese mi lepší zprávy…"
27,Jednou,úterý 19. března 2013,"Jednou – zmizím. Celý příběh
shrneš do dvou vět
v dalším krásném okouzlení,
když bude třeba vyprávět.

Ty toužíš vesmír ochutnávat
a poznat rychle celý svět,
být tulákem a vším se stát
a nevracet se zpět.

Nevíš, že  to, co hledáš,
může být v jediném pousmání,
v jediném srdci, po němž
pátráš bez přestání.

Však nehledáš v hlubinách,
plaveš na hladině zády,
nikdy nedohlédneš dolů
a dopouštíš se nejen v sobě zrady.

Tak nepoznáš, co bylo pravé
a poznáš všechno ""jen"",
nikdy nevzneseš se ke hvězdám
a nestaneš se básníkem.

Ztratíš poezii, ztratíš snění,
Tvá duše ukryje se do vzdálené skrýše
už ani pro Tebe nebude k nalezení
a Ty své srdce nikdy nevypíšeš."
28,Noční,pátek 8. března 2013,"Noc je jak černě počmáraný list
– jen občas lampa zabliká –
v ní abych mohla lépe číst
dřív, než ji k ránu světlo spolyká.

Hvězdy se pomalu točí
kolem své vlastní osy
ze tmy mžourají tisíce očí
a mezi nimi chybí nosy.

Netopýr ke svým průzkumným cestám
roztáhnout myší křídla musí,
prolétne kolem mě směrem z města,
rozvíří tmu, která dusí.

Noc je tak chladná jako čepel nože
– jen občas lampa zabliká –
vystoupí ke mě jako vlna z moře
a smutně se mě dotýká…"
29,Racek,pátek 15. března 2013,"Být rackem, letět daleko,
daleko k neklidnému moři,
mít jenom peří, letět nalehko
tam, kde slunce jako oheň hoří.

A potom dál až za moře,
zvednout se z oběžné dráhy,
navštívit hvězdy nahoře,
optat se, zda jsou zdrávy.

Neohlížet se nikdy zpátky,
zanechat dole na Zemi
minulost plnou jinovatky,
zamknout ji někde v přízemí.

Více se nedat strávit vášní,
raději pírka nežli víru ztrácet,
a nikdy nepochopit tvory zvláštní,
kterým sny dají příliš mnoho práce.

Za slovy nikdy nehledat, co není,
smetí si neplést se stříbrem,
utopit beznaděje v oceánu snění.
Já, osamělý racek, plachtím vesmírem."
30,Řez,sobota 9. března 2013,"Bolestné svítání,
na trávě jinovatka,
řez nožem do dlaní,
pomsta je tak sladká.
Za můj hřích,
za vášeň neskrývanou,
ptáci se smějí ve větvích,
z očí slzy kanou.
Tak trestá svět ty,
kdo neskrývají touhy,
srdce se mrská na dlaních
a řez je rovný, dlouhý."
31,Síla,pátek 29. března 2013,"Má síla je jen rozhoupaná loď,
opilý lodivod kormidlem otáčí,
nahni se nad vodu, lano mi hoď,
až vítr smete mě tam, kde nestačím.

Podej mi ruku a pevně ji chyť,
ať Tvůj sladký hlas v srdci mi zní,
jen v Tvých očích mrholí měsíční třpyt,
dám Ti svou lásku, síla je v ní."
32,Snídaně,neděle 31. března 2013,"Měsíc je bledý jak svitek pergamenu,
hřeben se noří do pramenů
mých vlasů, když je před usnutím
splývat po ramenou nutím.
Očima v té měsíční záři
představuji si, jak se tváříš,
když krasopisem na povrchu měsíce
necháš mi vzkaz a v nebi světel tisíce
jak sladkých teček za větami
září a pod nimi jsme my dva sami…
Čtu dopis psaný písmem psacím,
ve snech se potom k němu vracím
a zní mi krásně, zní mi zvláštně,
je to můj tajný šálek vášně.
Ráno pak sedím u snídaně v tričku,
slůvka mi stečou do hrníčku."
33,Spořivá,pondělí 25. března 2013,"Chtěli bychom létat jako ptáci…
jak vlaštovky, které se s jarem vrací.
Zatím…
šetříme dechem, šetříme časem,
šetříme láskou, svázáni lasem,
nemáme sebe pro samou práci,
nemáme nic, ani inspiraci.
A přitom stačí nastavit dlaně,
droboučká vločka snese se na ně –
myšlenka, nápad tvořený vzduchem,
kratičký nápěv zaznívá uchem.
Stačí se zasnít, zastavit chvíli,
uvidíš na dlažbě tancovat víly.
Každý má tolik, kolik chce cítit,
kolik se rozhodne z života chytit.
Neumím šetřit penězi, natož city,
do čela jasný osud mám vrytý.
Nešetřím láskou, kroky či slovy,
snad přijdou někomu vhod… kdo ví?
Únava doráží jak šelma dravá,
pro mě je tahle smrt jistě ta pravá.
Až potom přijdou mi náhrobek setřít,
napsáno bude: neuměla (se) šetřit…"
34,Vaření,čtvrtek 14. března 2013,"Rukama ze vzduchu lovím si slova,
potom je navlékám na tenkou šňůrku,
prsty je třídím, prohlížím znova,
loupu z nich starou nevzhlednou kůrku.

Když jsou tam všechny, mám dlouhý pruh,
zbytky slov shrnu do zásuvky stolu,
uzlíkem zavážu, uzavřu kruh,
Tobě je pošeptám, až budeme spolu…"
35,Večer,pátek 1. března 2013,"Když slunce zapadá a
za horou se ztrácí,
do večerního zpěvu žab
září plameňáci.

Na štíhlých nohách
něžné sametové peří
čechrají zobáky.
Čas naděje, kdy člověk věří,

že jednou opět spatří
záři, která se na oko tváří
jak růžové peří plameňáků,
o které tvrdí jenom lháři,

že není, že existuje jenom v snění
něžná a čistá, jak křídla bělásků.
Ať umřou bez ní, malověrní,
já umřu s ní a nebo pro ni, pro lásku…"
36,Vzpomínky,pátek 8. března 2013,"V oblacích ve tvaru draka
je vepsaný můj další osud.
Tvá vůně sladce obojaká,
kterou dýchala jsem dosud,
ztrácí se za posledním rohem
mé tajné noční výpravy.
Pod okny stojím, dávám Ti sbohem,
zhasíná okno, mizí Tvůj obrys mlhavý.
V objetí Tvých paží cítím se křehká..
Samota myšlenek je moje daň.
Vzpomínek na Tebe dotýkám se zlehka,
opatrně, jak otevřených ran.."
37,Ztracená,středa 27. března 2013,"O zeď opřená
v ztracené uličce vpitá do kamení,
skloněnou hlavu jak hříšník,
co čeká rozhřešení.
S očima dokořán o Tobě sním
a to se nemá.
Na pár okamžiků
zmizíme spolu do ztracena.
Až se mě dotkneš,
zcela jistě vím,
jak pečetní vosk
se roztavím.
Stačí Tvá vůně, dotek pouhý,
jsi věčná inspirace, můj anděl touhy.
Sedím tu na schodech, čekám na anděla,
v ztracené uličce … ztracená zcela."
38,Čápi,čtvrtek 4. dubna 2013,"Kroužili pod nebem, kroužili
dva sametoví černí čápi.
Mávám jim vzhůru na pozdrav
a oni, zda prý mě něco trápí…

Povídám, závidím vám,
vám, čarokřídlým ptákům,
křídly se něžně smíte dotýkat
a létat spolu k mrakům…

Já dotknout se Tě nesmím,
smím jen na ztvrdlé zemi stát,
dívat se za černými čápy,
mít zmrzlé prsty, čekat listopad…"
39,Chci,pondělí 22. dubna 2013,"Chci věřit v červnové svítání
Chci usínat s kouzelným kamínkem u srdce
Lehce Tě pohladit po skráni
Políbit bolístku, co nosíš na ruce

Chci zavřít oči a spatřit Tě pod víčky
Přinést Ti v náruči kytici bodláků
Do písku obrázek načmárat malíčky
Dýchat Tvou vůni a smát se Tvým rozpakům

Chtěla bych stát se leknínem na vodách
Chci být Tvým polštářem, když večer zíváš
Obejmout Tě a nepustit k Tobě strach
Chci sladkou písní být, kterou zpíváš"
40,Chodníčky,neděle 14. dubna 2013,"Hledal jsi anděla
– našel jsi světlonoše
Amor ho poranil
– trénoval střelbu z kuše.
Snad býval sám andělem
a peří ztratil v bouřích,
bloudil tmou s lucernou,
plavil se v temných mořích…

Někdy jsou chodníčky života
úzké a zamotané,
často se míjíme, za kliku bereme
každý na jiné straně.
Něco Ti zašeptá nahlédnout klíčovou dírkou
na chvilku pouhou,
tam: Oko – zamrká rozpaky,
vpíjí se do Tvého, chvěje se touhou…."
41,Harfa,sobota 20. dubna 2013,"Tělo je harfou mojí duše,
struny se chvěly, tys usedl a hrál,
srdce jsem cítila, jak kluše,
nabírá rychlost, klus mění se v cval.

Ten pohled bezedný mě dožene.
Ústy jsi nesliboval nic,
mé zorničky tak překvapené,
když prozradil jsi víc…

Tvé prsty pak svou něhu skryly
chladné a cizí hrály studeněji
a struny praskly, jen některé mi zbyly,
nevím nic, nic nevím o naději.

Pak už jen ticho, ani pár vět,
jen slzy střídám s nádechem.
Tak tedy končí svět, tak končí svět.

Bez velkého třesku, jen s tichým povzdechem."
42,Hledání,neděle 7. dubna 2013,"Blýská se na časy
déšť barvy odplavil
v klubíčku nejistot
v tomhletom počasí
snažím se ze všech sil
vyhledat světlý bod.

Jestli mi rozumíš
v mém smutném tápání
dej mi nějak znamení
třeba jen na chvíli
peříčko holubí
vtiskni mi do dlaní…"
43,Jaro,pondělí 8. dubna 2013,"Zima už troubí k ústupu,
když v háji trhám petrklíče,
jaro se vznáší ve vzduchu,
děti si venku hází s míčem.

Všechno se v slunci tetelí,
sousedů kluk mlsá polárku
a dva milenci nesmělí
vtančili spolu do parku.

Příroda křičí: ""Jaro přišlo k vám!""
a já teď náhle nevím…
Ač pod oknem mi kvete rudý tulipán,
nevím, proč na srdci cítím divnou tíhu,
jako když vlaštovky odlétají k jihu."
44,Jediná,středa 24. dubna 2013,"Alespoň jednou bych si přála,
aby na jedné ze svých cest
můj tulák ze snů, utkaný z hvězd,
mne objal, aby mu v očích touha hrála.

Jen jednu noc snít v teple jeho objetí.
Chtěla bych vědět, jaképak to je,
nechat se spoutat jeho tělem jako pečetí,
celou tu jedinou noc cítit, že mne miluje…"
45,Když mi scházíš,pátek 5. dubna 2013,"Když mi scházíš,
po kapsách nosím pilulky zapomnění.
Polykám po hrstech ty malé bobulky
a k ničemu to není.

Tiše si střádám slovíčka – malé kapky,
abych je pršela jako déšť do Tvých uší,
až budem spolu. Však náhle vyschne mi v krku,
když zašeptáš, že mi to sluší."
46,Vzdušné zámky,úterý 2. dubna 2013,"Ve dne pod stejným sluncem žhavým,

v noci pod tajemnými hvězdami,

já vzdušné zámky na břehu si stavím,

Ty pod napnutými plachtami.

S večerem smutek mě přepadá,

jsi pro mě veliká záhada.

Hebké rty voňavé po moři…

čekám, až mé srdce pokoříš.

Čekám tu na břehu schoulená

až obejmeš pevně má ramena

zády se opřu o Tvou horkou hruď

jen prosím, ještě chvíli se mnou buď….."
47,Maják,středa 10. dubna 2013,"Jak maják v rozbouřeném moři
námořníky varuji i lákám.
V mém srdci oheň hoří,
vysílá nocí signál dálkám.

V neklidném večeru bezhvězdném
Tvoje loď blízko ztroskotala,
Tys bojoval a plaval jsi až sem,
kde nad hladinu vystupuje skála.

Nesměle otevřel jsi staré dveře
a obsadil mou opuštěnou věž,
dal vale věčné nedůvěře,
večer co večer šeptal jsi mi: ""věř""

Buď navěky mým společníkem,
skála pod mořem je podemletá.
Jsem majákem, Ty trosečníkem,
my dva jsme spolu duší světa."
48,Malá lež,neděle 21. dubna 2013,"Když jsem šla ráno k Tobě,
usedl motýl do mých vlasů –
babočka kopřivová.

Miluji v téhle roční době
letních hlasů
přilétnout za Tebou zas a znova,

nechat se líbat
Tvými ústy,
nechat se laskat
Tvými prsty…
…
Že mě tou lží ústa nezebou,
dech se tají.
Tak brzy, jak já chodím za Tebou,
babočky nelétají…"
49,Přijď,středa 17. dubna 2013,"Přijď, Lásko, za oknem hoří svíčka,
ležím tu sama, zavřená víčka,
plamínek moje verše stráví
a marně čekám na Tvé zprávy.

Umírám denně a bez Tebe to bolí,
mám srdce v kleštích, sevření nepovolí.
Jsi perla vylovená z mořských hlubin,
léčivý kámen, tajemný rudý rubín.

Tvé prsty tančí v mých vlasech jako ve strunách,
když nejsi se mnou, cítím strach,
mé prázdné dlaně v nočním šeru zebou..
sevři je ve svých.. ach..zestárnout s Tebou…"
50,Prší,pátek 12. dubna 2013,"Když je mi smutno, pláčou mraky,
smáčí lán obilí a vlaštovkám fraky.
Nocí se nese smutné cinkání,
to slzy – mé kapky – něžně vyzvání.
K ránu pak vánek pole osuší
a vlaštovky se koupou v kalužích.."
51,Sídliště,středa 10. dubna 2013,"V noci
bez Tebe
otevřu okno dokořán
ať slyším chodit
kapky po římsách
nad sídliště se
vznesl kormorán
už dávno přišel jeho čas
pták snů vzlétne
vždycky po večeři
pak jeho křídla
dotknou se Tvých řas
pohladí Tvoje víčka
a načechrá si peří
na němž se třpytí
vůně cizí země
a ten pták cítí,
ten pták věří,
že ve Tvém snu jsem já,
že jsem tam s Tebou
a Ty
dotkneš se mě…"
52,V klíně,středa 3. dubna 2013,"Píšeš si něco v telefonu,
já se Ti schoulím do klína
a po tom celodenním shonu
s Tvými prsty ve vlasech… usínám."
53,Taxikář,úterý 30. dubna 2013,"Dala bych království jen pro Tvůj smích
Vyvěrá z hloubky větší než řeky pramen
Je jako koncert slavíků ve větvích
Hebce mě objímá kolem ramen

Nauč mě životu, lásce, smíchu,
Obklop mě něhou, umím jak kotě příst
Nauč mě splynout v nočním tichu
Budu Ti s úplňkem potichu verše číst

Nemohu platit zlatými pruty
Jen svoje srdce v dlaních mám
Řekni, že stačí to, nebuď krutý
Vezmi mě, lásko – ke hvězdám…"
54,Usínání,sobota 13. dubna 2013,"Lásko má, nemůžu usnout
bez Tebe.
Dívám se temným oknem
do nebe,
zda neuvidím kometu,
abych si mohla snít svá přání
při její výpravě dlouhého doletu
a při mém usínání.

Vím, že když si tak po papíře
s kometou poletuji,
tak Ty si myslíš, že
své řádky opisuji.
Věř mi a dýchej zlehka, tiše,
ať slyšíš, co moje srdce
na papír tužkou píše.

A dneska zpod peřin
dívej se do noci –
ať i Ty vidíš
hvězdné zrcadlení.
Potom lež a hlavně
neusínej,
nebo se probudíš
s očima,
v nichž to není."
55,Úsměv,úterý 16. dubna 2013,"Probuď se, lásko, nespi už,
po nebi se rozpíjí černá tuš
a v ní se třpytí kapky rosy,
co každý večer vzpomenou si,
kde nechalo je chladné ráno,
když měl jsi ještě rozespáno…

Otevřeš okno – tma je tu,
můžeš si teď co chceš přát.
Copak nevidíš kometu
bláznivou rychlostí se hnát?
Vítr Tě polechtá po tváři
zabořené v bílém polštáři
a Ty se usmíváš…
a víš, že když Ti bude zima na nohy,
přikryju Tě kusem oblohy…"
